{"schemaVersion":"1.0","projectionType":"BKL031_F7_PROTECTED_SITE_SANITIZED_FORECAST_PROJECTION","projectionId":"BKL031-F7-SITE-FORECAST-35255829165","environment":"EVALUATION","authority":"NONE","publicationState":"READ_ONLY","site":{"publicLabel":"Manciano (GR), Italia","timezoneIana":"Europe/Rome","coordinateDisclosure":"PROHIBITED"},"sourceEvidence":{"workflowRunId":35255829165,"workflowHeadSha":"2c46ca8be59c9ea8245fa03de71e936249c52a1b","artifactDigest":"sha256:9c2c58f4f4d63bced1110b94de4463f17eb0a2bc14362c22bb3435cbce9455ef","acceptedHourlyInstantCount":71,"excludedHourlyInstantCount":1,"imputedValueCount":0},"model":{"providerId":"OPEN_METEO","upstreamAuthorityId":"ITALIAMETEO_ARPAE","modelId":"italia_meteo_arpae_icon_2i","displayName":"ItaliaMeteo/ARPAE ICON-2I via Open-Meteo Single Runs","runInitialisationUtc":"2026-09-17T12:00Z","retrievedAtUtc":"2026-09-17T17:57:24.089Z","maxRunAgeHours":18,"runAgeHoursAtRetrieval":5.956691,"freshnessState":"FRESH"},"validity":{"fromUtc":"2026-09-17T13:00Z","toUtcExclusive":"2026-09-20T12:00:00Z"},"nightWindow":{"label":"Notte 17–18 settembre 2026","fromUtc":"2026-09-17T16:00:00Z","toUtcExclusive":"2026-09-18T06:00:00Z","localTimezone":"Europe/Rome"},"forecast":{"availabilityState":"DEGRADED","units":{"time":"iso8601","temperature_2m":"°C","relative_humidity_2m":"%","dew_point_2m":"°C","precipitation":"mm","cloud_cover":"%","cloud_cover_low":"%","cloud_cover_mid":"%","cloud_cover_high":"%","wind_speed_10m":"km/h","wind_gusts_10m":"km/h"},"hourly":[{"validAtUtc":"2026-09-17T13:00Z","temperatureC":26.1,"relativeHumidityPct":65,"dewPointC":19,"precipitationMm":0,"cloudCoverPct":92,"cloudCoverLowPct":92,"cloudCoverMidPct":0,"cloudCoverHighPct":0,"windSpeedKmh":20.2,"windGustKmh":33.5},{"validAtUtc":"2026-09-17T14:00Z","temperatureC":25.4,"relativeHumidityPct":70,"dewPointC":19.5,"precipitationMm":0,"cloudCoverPct":66,"cloudCoverLowPct":66,"cloudCoverMidPct":0,"cloudCoverHighPct":0,"windSpeedKmh":19.4,"windGustKmh":34.9},{"validAtUtc":"2026-09-17T15:00Z","temperatureC":25.3,"relativeHumidityPct":72,"dewPointC":19.8,"precipitationMm":0,"cloudCoverPct":65,"cloudCoverLowPct":65,"cloudCoverMidPct":0,"cloudCoverHighPct":0,"windSpeedKmh":17.3,"windGustKmh":32},{"validAtUtc":"2026-09-17T16:00Z","temperatureC":24.6,"relativeHumidityPct":79,"dewPointC":20.7,"precipitationMm":0,"cloudCoverPct":52,"cloudCoverLowPct":52,"cloudCoverMidPct":0,"cloudCoverHighPct":1,"windSpeedKmh":12.2,"windGustKmh":28.4},{"validAtUtc":"2026-09-17T17:00Z","temperatureC":23.7,"relativeHumidityPct":84,"dewPointC":20.8,"precipitationMm":0,"cloudCoverPct":39,"cloudCoverLowPct":39,"cloudCoverMidPct":0,"cloudCoverHighPct":0,"windSpeedKmh":9,"windGustKmh":21.2},{"validAtUtc":"2026-09-17T18:00Z","temperatureC":22.8,"relativeHumidityPct":90,"dewPointC":21,"precipitationMm":0,"cloudCoverPct":51,"cloudCoverLowPct":32,"cloudCoverMidPct":0,"cloudCoverHighPct":21,"windSpeedKmh":1.8,"windGustKmh":13.7},{"validAtUtc":"2026-09-17T19:00Z","temperatureC":22.3,"relativeHumidityPct":91,"dewPointC":20.8,"precipitationMm":0,"cloudCoverPct":62,"cloudCoverLowPct":50,"cloudCoverMidPct":0,"cloudCoverHighPct":28,"windSpeedKmh":4,"windGustKmh":6.8},{"validAtUtc":"2026-09-17T20:00Z","temperatureC":22.1,"relativeHumidityPct":92,"dewPointC":20.7,"precipitationMm":0,"cloudCoverPct":45,"cloudCoverLowPct":45,"cloudCoverMidPct":0,"cloudCoverHighPct":0,"windSpeedKmh":4.3,"windGustKmh":7.6},{"validAtUtc":"2026-09-17T21:00Z","temperatureC":21.8,"relativeHumidityPct":92,"dewPointC":20.4,"precipitationMm":0,"cloudCoverPct":4,"cloudCoverLowPct":4,"cloudCoverMidPct":0,"cloudCoverHighPct":0,"windSpeedKmh":4,"windGustKmh":9},{"validAtUtc":"2026-09-17T22:00Z","temperatureC":21.5,"relativeHumidityPct":92,"dewPointC":20.1,"precipitationMm":0,"cloudCoverPct":48,"cloudCoverLowPct":24,"cloudCoverMidPct":36,"cloudCoverHighPct":0,"windSpeedKmh":5.4,"windGustKmh":11.5},{"validAtUtc":"2026-09-17T23:00Z","temperatureC":21.4,"relativeHumidityPct":92,"dewPointC":20,"precipitationMm":0,"cloudCoverPct":86,"cloudCoverLowPct":65,"cloudCoverMidPct":34,"cloudCoverHighPct":40,"windSpeedKmh":4.7,"windGustKmh":11.5},{"validAtUtc":"2026-09-18T00:00Z","temperatureC":21.5,"relativeHumidityPct":90,"dewPointC":19.8,"precipitationMm":0,"cloudCoverPct":92,"cloudCoverLowPct":83,"cloudCoverMidPct":23,"cloudCoverHighPct":32,"windSpeedKmh":5.4,"windGustKmh":12.2},{"validAtUtc":"2026-09-18T01:00Z","temperatureC":21.3,"relativeHumidityPct":92,"dewPointC":19.9,"precipitationMm":0,"cloudCoverPct":63,"cloudCoverLowPct":58,"cloudCoverMidPct":11,"cloudCoverHighPct":4,"windSpeedKmh":6.1,"windGustKmh":12.6},{"validAtUtc":"2026-09-18T02:00Z","temperatureC":21.3,"relativeHumidityPct":91,"dewPointC":19.8,"precipitationMm":0,"cloudCoverPct":65,"cloudCoverLowPct":60,"cloudCoverMidPct":0,"cloudCoverHighPct":27,"windSpeedKmh":6.5,"windGustKmh":13.3},{"validAtUtc":"2026-09-18T03:00Z","temperatureC":21.3,"relativeHumidityPct":89,"dewPointC":19.4,"precipitationMm":0,"cloudCoverPct":95,"cloudCoverLowPct":70,"cloudCoverMidPct":0,"cloudCoverHighPct":80,"windSpeedKmh":8.3,"windGustKmh":16.2},{"validAtUtc":"2026-09-18T04:00Z","temperatureC":21.1,"relativeHumidityPct":90,"dewPointC":19.3,"precipitationMm":0,"cloudCoverPct":90,"cloudCoverLowPct":66,"cloudCoverMidPct":0,"cloudCoverHighPct":66,"windSpeedKmh":6.1,"windGustKmh":16.2},{"validAtUtc":"2026-09-18T05:00Z","temperatureC":20.9,"relativeHumidityPct":91,"dewPointC":19.4,"precipitationMm":0,"cloudCoverPct":66,"cloudCoverLowPct":58,"cloudCoverMidPct":0,"cloudCoverHighPct":29,"windSpeedKmh":6.8,"windGustKmh":13.3},{"validAtUtc":"2026-09-18T06:00Z","temperatureC":21.3,"relativeHumidityPct":91,"dewPointC":19.8,"precipitationMm":0,"cloudCoverPct":70,"cloudCoverLowPct":59,"cloudCoverMidPct":0,"cloudCoverHighPct":39,"windSpeedKmh":6.5,"windGustKmh":15.5},{"validAtUtc":"2026-09-18T07:00Z","temperatureC":22.2,"relativeHumidityPct":88,"dewPointC":20.1,"precipitationMm":0,"cloudCoverPct":67,"cloudCoverLowPct":63,"cloudCoverMidPct":0,"cloudCoverHighPct":17,"windSpeedKmh":9.4,"windGustKmh":19.1},{"validAtUtc":"2026-09-18T08:00Z","temperatureC":23.5,"relativeHumidityPct":86,"dewPointC":21,"precipitationMm":0,"cloudCoverPct":90,"cloudCoverLowPct":73,"cloudCoverMidPct":0,"cloudCoverHighPct":80,"windSpeedKmh":14.8,"windGustKmh":23.4},{"validAtUtc":"2026-09-18T09:00Z","temperatureC":25.1,"relativeHumidityPct":66,"dewPointC":18.3,"precipitationMm":0,"cloudCoverPct":39,"cloudCoverLowPct":39,"cloudCoverMidPct":0,"cloudCoverHighPct":0,"windSpeedKmh":17.6,"windGustKmh":29.9},{"validAtUtc":"2026-09-18T10:00Z","temperatureC":25.7,"relativeHumidityPct":62,"dewPointC":17.8,"precipitationMm":0,"cloudCoverPct":37,"cloudCoverLowPct":37,"cloudCoverMidPct":0,"cloudCoverHighPct":0,"windSpeedKmh":19.1,"windGustKmh":32.4},{"validAtUtc":"2026-09-18T11:00Z","temperatureC":26.2,"relativeHumidityPct":56,"dewPointC":16.7,"precipitationMm":0,"cloudCoverPct":8,"cloudCoverLowPct":8,"cloudCoverMidPct":0,"cloudCoverHighPct":0,"windSpeedKmh":19.8,"windGustKmh":33.5},{"validAtUtc":"2026-09-18T12:00Z","temperatureC":26.3,"relativeHumidityPct":54,"dewPointC":16.3,"precipitationMm":0,"cloudCoverPct":21,"cloudCoverLowPct":20,"cloudCoverMidPct":0,"cloudCoverHighPct":0,"windSpeedKmh":20.5,"windGustKmh":35.3},{"validAtUtc":"2026-09-18T13:00Z","temperatureC":26.2,"relativeHumidityPct":54,"dewPointC":16.1,"precipitationMm":0,"cloudCoverPct":27,"cloudCoverLowPct":27,"cloudCoverMidPct":0,"cloudCoverHighPct":0,"windSpeedKmh":19.8,"windGustKmh":34.9},{"validAtUtc":"2026-09-18T14:00Z","temperatureC":25.7,"relativeHumidityPct":56,"dewPointC":16.3,"precipitationMm":0,"cloudCoverPct":3,"cloudCoverLowPct":3,"cloudCoverMidPct":0,"cloudCoverHighPct":0,"windSpeedKmh":18.7,"windGustKmh":33.8},{"validAtUtc":"2026-09-18T15:00Z","temperatureC":25.2,"relativeHumidityPct":55,"dewPointC":15.5,"precipitationMm":0,"cloudCoverPct":100,"cloudCoverLowPct":0,"cloudCoverMidPct":0,"cloudCoverHighPct":100,"windSpeedKmh":14.4,"windGustKmh":31.7},{"validAtUtc":"2026-09-18T16:00Z","temperatureC":24.3,"relativeHumidityPct":68,"dewPointC":18,"precipitationMm":0,"cloudCoverPct":50,"cloudCoverLowPct":26,"cloudCoverMidPct":0,"cloudCoverHighPct":35,"windSpeedKmh":9.7,"windGustKmh":24.5},{"validAtUtc":"2026-09-18T17:00Z","temperatureC":23.4,"relativeHumidityPct":77,"dewPointC":19.1,"precipitationMm":0,"cloudCoverPct":96,"cloudCoverLowPct":56,"cloudCoverMidPct":0,"cloudCoverHighPct":90,"windSpeedKmh":5,"windGustKmh":16.6},{"validAtUtc":"2026-09-18T18:00Z","temperatureC":22.3,"relativeHumidityPct":82,"dewPointC":19,"precipitationMm":0,"cloudCoverPct":100,"cloudCoverLowPct":34,"cloudCoverMidPct":0,"cloudCoverHighPct":100,"windSpeedKmh":3.6,"windGustKmh":8.6},{"validAtUtc":"2026-09-18T19:00Z","temperatureC":21.5,"relativeHumidityPct":86,"dewPointC":19,"precipitationMm":0,"cloudCoverPct":95,"cloudCoverLowPct":37,"cloudCoverMidPct":33,"cloudCoverHighPct":86,"windSpeedKmh":3.6,"windGustKmh":8.3},{"validAtUtc":"2026-09-18T20:00Z","temperatureC":21,"relativeHumidityPct":85,"dewPointC":18.3,"precipitationMm":0,"cloudCoverPct":74,"cloudCoverLowPct":35,"cloudCoverMidPct":57,"cloudCoverHighPct":0,"windSpeedKmh":4,"windGustKmh":9.7},{"validAtUtc":"2026-09-18T21:00Z","temperatureC":20.7,"relativeHumidityPct":83,"dewPointC":17.7,"precipitationMm":0,"cloudCoverPct":59,"cloudCoverLowPct":43,"cloudCoverMidPct":35,"cloudCoverHighPct":0,"windSpeedKmh":2.9,"windGustKmh":8.6},{"validAtUtc":"2026-09-18T22:00Z","temperatureC":20.4,"relativeHumidityPct":82,"dewPointC":17.2,"precipitationMm":0,"cloudCoverPct":52,"cloudCoverLowPct":0,"cloudCoverMidPct":53,"cloudCoverHighPct":0,"windSpeedKmh":5.8,"windGustKmh":10.4},{"validAtUtc":"2026-09-18T23:00Z","temperatureC":20.4,"relativeHumidityPct":83,"dewPointC":17.4,"precipitationMm":0,"cloudCoverPct":48,"cloudCoverLowPct":0,"cloudCoverMidPct":49,"cloudCoverHighPct":0,"windSpeedKmh":5.4,"windGustKmh":12.6},{"validAtUtc":"2026-09-19T00:00Z","temperatureC":20.2,"relativeHumidityPct":84,"dewPointC":17.4,"precipitationMm":0,"cloudC